{
  "schema_version": "0.1",
  "task_id": "date-fns-zh-month",
  "task_base_commit": "39d1e14200cead9e4be5df88695b5e82082875ed",
  "intervention_level": "L1_context",
  "design": "cumulative",
  "payload": {
    "context": {
      "regions": [
        {
          "path": "pkgs/core/src/locale/zh-CN/_lib/match/index.ts",
          "start_line": 27,
          "end_line": 60
        }
      ]
    }
  },
  "source": {
    "kind": "model_authored_unreviewed",
    "evidence_refs": [
      "base:pkgs/core/src/locale/zh-CN/_lib/match/index.ts:27-60"
    ],
    "fixed_commit_accessible_to_agent": false,
    "facts_visible_from_base": true
  },
  "information_boundary": {
    "allowed_categories": [
      "context"
    ],
    "forbidden_categories": [
      "patch_text",
      "fixed_commit",
      "hidden_evaluator",
      "implementation_instruction",
      "L2_localization",
      "L3_observation",
      "L4_diagnosis",
      "L5_plan"
    ],
    "contains_diagnosis": false,
    "contains_plan": false,
    "contains_code_location": true,
    "contains_exact_identifier": false,
    "contains_patch_text": false
  },
  "review_status": "pending_independent_review",
  "provenance": {
    "author_id": "codex-sol-primary-2026-08-02",
    "author_class": "model_assisted_primary_author",
    "created_at": "2026-08-02T06:30:00Z",
    "rubric_version": "oracle-boundary/1.0.0",
    "revision": 1,
    "content_sha256": "26b4806f87f30135d56d80d9a75a014adc4fc6afc6c0413922f68bcd72f391c2"
  }
}
