{
  "schema_version": "0.1",
  "task_id": "date-fns-zh-month",
  "task_base_commit": "39d1e14200cead9e4be5df88695b5e82082875ed",
  "intervention_level": "L4_diagnosis",
  "design": "cumulative",
  "payload": {
    "context": {
      "regions": [
        {
          "path": "pkgs/core/src/locale/zh-CN/_lib/match/index.ts",
          "start_line": 27,
          "end_line": 60
        }
      ]
    },
    "localization": {
      "symbols": [
        {
          "path": "pkgs/core/src/locale/zh-CN/_lib/match/index.ts",
          "name": "matchMonthPatterns",
          "kind": "variable"
        },
        {
          "path": "pkgs/core/src/locale/zh-CN/_lib/match/index.ts",
          "name": "parseMonthPatterns",
          "kind": "variable"
        }
      ],
      "failing_boundary": {
        "producer_symbol": "matchMonthPatterns",
        "consumer_symbol": "parseMonthPatterns",
        "type": "return"
      }
    },
    "observation": {
      "facts": [
        {
          "statement": "With zh-CN, the base parser returns invalid dates for numeric and wide-form October; the same evaluator reports month 1 for numeric November and December.",
          "evidence_refs": [
            "evidence:base-run"
          ],
          "certainty": "observed"
        }
      ]
    },
    "diagnosis": {
      "root_cause": "The Chinese month match and parse alternatives accept ambiguous prefixes for the two-digit months, allowing a shorter month token to win before the complete October-through-December token is classified.",
      "supporting_evidence_refs": [
        "base:pkgs/core/src/locale/zh-CN/_lib/match/index.ts:27-60",
        "evidence:base-run"
      ],
      "certainty": "confirmed"
    }
  },
  "source": {
    "kind": "model_authored_unreviewed",
    "evidence_refs": [
      "base:pkgs/core/src/locale/zh-CN/_lib/match/index.ts:27-60",
      "control/task-validation.json#base"
    ],
    "fixed_commit_accessible_to_agent": false,
    "facts_visible_from_base": false
  },
  "information_boundary": {
    "allowed_categories": [
      "context",
      "localization",
      "observation",
      "diagnosis"
    ],
    "forbidden_categories": [
      "patch_text",
      "fixed_commit",
      "hidden_evaluator",
      "implementation_instruction",
      "L5_plan"
    ],
    "contains_diagnosis": true,
    "contains_plan": false,
    "contains_code_location": true,
    "contains_exact_identifier": true,
    "contains_patch_text": false
  },
  "review_status": "pending_independent_review",
  "provenance": {
    "author_id": "codex-sol-primary-2026-08-02",
    "author_class": "model_assisted_primary_author",
    "created_at": "2026-08-02T06:30:00Z",
    "rubric_version": "oracle-boundary/1.0.0",
    "revision": 1,
    "content_sha256": "37081109f7c4a25aa0c93c9367ca4615a726a3235b3c16c789ba269bc5f7adea"
  }
}
