{
  "schema_version": "0.1",
  "task_id": "zod-tuple-default",
  "task_base_commit": "ec979ad783a9e9c992d3c9bd4e5f3b56110b1ef8",
  "intervention_level": "L5_plan",
  "design": "cumulative",
  "payload": {
    "context": {
      "regions": [
        {
          "path": "packages/zod/src/v4/core/schemas.ts",
          "start_line": 2635,
          "end_line": 2714
        }
      ]
    },
    "localization": {
      "symbols": [
        {
          "path": "packages/zod/src/v4/core/schemas.ts",
          "name": "$ZodTuple",
          "kind": "variable"
        },
        {
          "path": "packages/zod/src/v4/core/schemas.ts",
          "name": "handleTupleResult",
          "kind": "function"
        }
      ],
      "failing_boundary": {
        "producer_symbol": "$ZodTuple",
        "consumer_symbol": "handleTupleResult",
        "type": "call"
      }
    },
    "observation": {
      "facts": [
        {
          "statement": "Parsing the two-item tuple [string, string.default('fallback')] with the one-item input ['present'] returns the one-item output ['present'] with length 1.",
          "evidence_refs": [
            "evidence:base-run"
          ],
          "certainty": "observed"
        }
      ]
    },
    "diagnosis": {
      "root_cause": "The tuple parser classifies every absent position at or beyond its optional-input boundary as skippable, including schemas that produce a defined output from absent input.",
      "supporting_evidence_refs": [
        "base:packages/zod/src/v4/core/schemas.ts:2638-2681",
        "evidence:base-run"
      ],
      "certainty": "confirmed"
    },
    "plan": {
      "behavioral_objective": "Materialize an omitted tuple position when its schema produces a defined output, while continuing to omit trailing positions whose output is genuinely optional.",
      "constraints": [
        "Preserve explicit undefined values that were present in the input.",
        "Preserve rest-item handling and issue ordering.",
        "Keep synchronous and asynchronous item parsing behavior equivalent."
      ],
      "non_goals": [
        "Do not redesign tuple syntax.",
        "Do not change object-property default behavior."
      ]
    }
  },
  "source": {
    "kind": "model_authored_unreviewed",
    "evidence_refs": [
      "visible/issue.md",
      "control/task-validation.json#base"
    ],
    "fixed_commit_accessible_to_agent": false,
    "facts_visible_from_base": false
  },
  "information_boundary": {
    "allowed_categories": [
      "context",
      "localization",
      "observation",
      "diagnosis",
      "plan"
    ],
    "forbidden_categories": [
      "patch_text",
      "fixed_commit",
      "hidden_evaluator",
      "implementation_instruction"
    ],
    "contains_diagnosis": true,
    "contains_plan": true,
    "contains_code_location": true,
    "contains_exact_identifier": true,
    "contains_patch_text": false
  },
  "review_status": "pending_independent_review",
  "provenance": {
    "author_id": "codex-sol-primary-2026-08-02",
    "author_class": "model_assisted_primary_author",
    "created_at": "2026-08-02T06:30:00Z",
    "rubric_version": "oracle-boundary/1.0.0",
    "revision": 1,
    "content_sha256": "1ab63137c5ee2e79bfc001808dc4c9472848ee538fbb01132cf7e0eef539c72a"
  }
}
